{
  "schema": "xcodebuildmcp.output.bundle-id",
  "schemaVersion": "2",
  "didError": false,
  "error": null,
  "data": {
    "artifacts": {
      "appPath": "<TMPDIR>/BundleTest.app",
      "bundleId": "com.test.snapshot"
    }
  },
  "nextSteps": [
    "Launch the app: xcodebuildmcp macos launch --app-path <TMPDIR>/BundleTest.app",
    "Build again: xcodebuildmcp macos build --scheme SCHEME_NAME"
  ]
}
